{
 "register": "al-Saʿdī, al-Qawāʿid wa'l-Uṣūl al-Jāmiʿa: apparent contradictions inside the bank, resolved by the bank",
 "method": "Two qawāʿid, each read without its qayd, rule opposite ways on a shared case. The pair is resolved by the bank's own order (Usul.resolve: jamʿ, naskh, tarjīḥ, tawaqquf) and its rules of reading (Q29: a word is read with what is attached to it; Q57: give effect to both wherever possible). The qayd is always the author's own sentence; nothing is imported.",
 "witness": "islamhouse-qj-doc",
 "module": "Usul.Tanaqud",
 "lean": [
  "Usul.Tanaqud.Pair",
  "Usul.Tanaqud.Pair.jam",
  "Usul.Tanaqud.Pair.Clash",
  "Usul.Tanaqud.Pair.jam_first",
  "Usul.Tanaqud.Pair.jam_second",
  "Usul.Tanaqud.resolve_takes_jam"
 ],
 "proved_earlier": [
  {
   "rules": [
    13,
    36
   ],
   "lean": [
    "Usul.Muamalat.q13_q36_consistent"
   ]
  },
  {
   "rules": [
    26,
    43
   ],
   "lean": [
    "Usul.Muamalat.q26_q43_consistent"
   ]
  },
  {
   "rules": [
    51,
    54
   ],
   "lean": [
    "Usul.Muamalat.q51_q54_consistent"
   ]
  }
 ],
 "pairs": [
  {
   "id": "T-01",
   "rules": [
    13,
    27
   ],
   "case_en": "A muḥrim forgetfully kills game: Q13 makes destruction compensable whatever the mental state; Q27 discharges a prohibited act done in forgetfulness.",
   "resolution": "jam",
   "qayd_en": "Whose right: a human's right follows Q13, God's right follows Q27.",
   "author": [
    {
     "ref": "src:islamhouse-qj-doc#q013",
     "excerpt_ar": "والفرق بينه وبين أموال الآدميين: أن الحق في قتل الصيد للمحرم لله، والإثم مترتب على القصد، فكذلك الجزاء"
    }
   ],
   "reading_rules": [
    29
   ],
   "lean": [
    "Usul.Tanaqud.t1",
    "Usul.Tanaqud.t1_clash",
    "Usul.Tanaqud.t1_jam"
   ],
   "table": [
    {
     "case": [
      "adami",
      "deliberate"
     ],
     "first": true,
     "second": true,
     "jam": true
    },
    {
     "case": [
      "adami",
      "ignorant"
     ],
     "first": true,
     "second": false,
     "jam": true
    },
    {
     "case": [
      "adami",
      "forgetful"
     ],
     "first": true,
     "second": false,
     "jam": true
    },
    {
     "case": [
      "allah",
      "deliberate"
     ],
     "first": true,
     "second": true,
     "jam": true
    },
    {
     "case": [
      "allah",
      "ignorant"
     ],
     "first": true,
     "second": false,
     "jam": false
    },
    {
     "case": [
      "allah",
      "forgetful"
     ],
     "first": true,
     "second": false,
     "jam": false
    }
   ]
  },
  {
   "id": "T-02",
   "rules": [
    20,
    25
   ],
   "case_en": "The entitled is unknown and the thing indivisible: Q20 treats the unknown owner as absent; Q25 casts lots.",
   "resolution": "jam",
   "qayd_en": "Known competing claimants follow Q25; an owner nobody can identify follows Q20.",
   "author": [
    {
     "ref": "src:islamhouse-qj-doc#q020",
     "excerpt_ar": "يعني إذا علمنا أن المال ملك للغير، ولكن ذلك الغير تعذر علينا معرفته، وأيسنا منه جعلناه كالمعدوم"
    },
    {
     "ref": "src:islamhouse-qj-doc#q025",
     "excerpt_ar": "فمتى تشاح اثنان فأكثر في الأذان أو الإقامة، أو الإمامة ولم يكن لأحدهما مرجح أقرع بينهم"
    }
   ],
   "reading_rules": [
    29
   ],
   "lean": [
    "Usul.Tanaqud.t2",
    "Usul.Tanaqud.t2_clash",
    "Usul.Tanaqud.t2_jam"
   ],
   "table": [
    {
     "case": [
      true
     ],
     "first": "lot",
     "second": "publicInterest",
     "jam": "lot"
    },
    {
     "case": [
      false
     ],
     "first": "lot",
     "second": "publicInterest",
     "jam": "publicInterest"
    }
   ]
  },
  {
   "id": "T-03",
   "rules": [
    31,
    41
   ],
   "case_en": "Two kaffārāt owed: Q31 has each cause work its own effect; Q41 merges two acts of worship of one kind.",
   "resolution": "jam",
   "qayd_en": "One shared purpose merges (Q41); distinct purposes stay apart (Q31).",
   "author": [
    {
     "ref": "src:islamhouse-qj-doc#q041",
     "excerpt_ar": "واكتفي عنهما بفعل واحد إذا كان مقصودهما واحد"
    },
    {
     "ref": "src:islamhouse-qj-doc#q041",
     "excerpt_ar": "وأما إذا كانت الكفارات متباينة مقاصدها ككفارة ظهار، ويمين بالله، أو للوطء في نهار رمضان وحنث في الجميع، وجب عليه كفارات"
    }
   ],
   "reading_rules": [
    29
   ],
   "lean": [
    "Usul.Tanaqud.t3",
    "Usul.Tanaqud.t3_clash",
    "Usul.Tanaqud.t3_jam"
   ],
   "table": [
    {
     "case": [
      true
     ],
     "first": 1,
     "second": 2,
     "jam": 1
    },
    {
     "case": [
      false
     ],
     "first": 1,
     "second": 2,
     "jam": 2
    }
   ]
  },
  {
   "id": "T-04",
   "rules": [
    55,
    57
   ],
   "case_en": "A confessor says he meant otherwise: Q57 carries speech on its intent; Q55 binds the confessor even if he claims error.",
   "resolution": "jam",
   "qayd_en": "When another's right is attached and he demands the wording, the outward governs (Q55); otherwise the intent (Q57).",
   "author": [
    {
     "ref": "src:islamhouse-qj-doc#q057",
     "excerpt_ar": "وأما إذا تعلق بكلامه حق للغير فكذلك نعتبر ما نوى إلا أن ذلك الغير إذا طالبه بمقتضى لفظه لم يكن لنا أن نحكم إلا بالظاهر"
    }
   ],
   "reading_rules": [
    29
   ],
   "lean": [
    "Usul.Tanaqud.t4",
    "Usul.Tanaqud.t4_clash",
    "Usul.Tanaqud.t4_jam"
   ],
   "table": [
    {
     "case": [
      true
     ],
     "first": true,
     "second": false,
     "jam": true
    },
    {
     "case": [
      false
     ],
     "first": true,
     "second": false,
     "jam": false
    }
   ]
  },
  {
   "id": "T-05",
   "rules": [
    17,
    39
   ],
   "case_en": "An act done early: Q17 deprives whoever hastens a thing before its time; Q39 allows advancing after the cause, before the condition.",
   "resolution": "jam",
   "qayd_en": "Before the cause, Q17; after the cause and before the condition, Q39.",
   "author": [
    {
     "ref": "src:islamhouse-qj-doc#q017",
     "excerpt_ar": "فإذا تعجل الأمور التي يترتب عليها حكم شرعي قبل وجود أسبابها الصحيحة، لم يفده شيئا"
    },
    {
     "ref": "src:islamhouse-qj-doc#q039",
     "excerpt_ar": "ويجوز تقديمها بعد وجود السبب، وقبل شرط الوجوب وتحققه"
    }
   ],
   "reading_rules": [
    29
   ],
   "lean": [
    "Usul.Tanaqud.t5",
    "Usul.Tanaqud.t5_clash",
    "Usul.Tanaqud.t5_jam"
   ],
   "table": [
    {
     "case": [
      true
     ],
     "first": true,
     "second": false,
     "jam": true
    },
    {
     "case": [
      false
     ],
     "first": true,
     "second": false,
     "jam": false
    }
   ]
  },
  {
   "id": "T-06",
   "rules": [
    4,
    40
   ],
   "case_en": "Someone unable to do the whole of a command: Q4 lifts the obligation with inability; Q40 obliges the part one can do.",
   "resolution": "jam",
   "qayd_en": "Inability lifts only the part it reaches, except a part that is a pure means (wasīla maḥḍa).",
   "author": [
    {
     "ref": "src:islamhouse-qj-doc#q040",
     "excerpt_ar": "فإن قدر على بعضه وعجز عن باقيه وجب عليه فعل ما قدر عليه، إلا أن يكون المقدور عليه وسيلة محضة"
    }
   ],
   "reading_rules": [
    29,
    31
   ],
   "lean": [
    "Usul.Tanaqud.t6",
    "Usul.Tanaqud.t6_clash",
    "Usul.Tanaqud.t6_jam",
    "Usul.Tanaqud.t6_obligedParts"
   ],
   "table": [
    {
     "case": [
      true,
      false
     ],
     "first": true,
     "second": false,
     "jam": true
    },
    {
     "case": [
      true,
      true
     ],
     "first": false,
     "second": false,
     "jam": false
    },
    {
     "case": [
      false,
      false
     ],
     "first": true,
     "second": false,
     "jam": false
    },
    {
     "case": [
      false,
      true
     ],
     "first": false,
     "second": false,
     "jam": false
    }
   ]
  },
  {
   "id": "T-07",
   "rules": [
    21,
    50
   ],
   "case_en": "The unseen foundations of a sold house: Q21 forbids gharar in exchanges; Q50 establishes what follows.",
   "resolution": "jam",
   "qayd_en": "What follows a known whole is established with it (Q50); what stands alone falls under Q21.",
   "author": [
    {
     "ref": "src:islamhouse-qj-doc#q050",
     "excerpt_ar": "وكذلك لا يجوز بيع المجهول الذي لم يرَ ولم يوصف، لكن إذا بيعت الدار ونحوها دخلت فيها الأساسات"
    }
   ],
   "reading_rules": [
    29
   ],
   "lean": [
    "Usul.Tanaqud.t7",
    "Usul.Tanaqud.t7_clash",
    "Usul.Tanaqud.t7_jam"
   ],
   "table": [
    {
     "case": [
      true
     ],
     "first": false,
     "second": true,
     "jam": false
    },
    {
     "case": [
      false
     ],
     "first": false,
     "second": true,
     "jam": true
    }
   ]
  },
  {
   "id": "T-08",
   "rules": [
    11,
    52
   ],
   "case_en": "A presumption against a contrary indicator: Q11 keeps what was against doubt; Q52 prefers strong indicators over the presumption.",
   "resolution": "jam",
   "qayd_en": "The presumption holds where nothing outweighs it; what is stronger than doubt displaces it.",
   "author": [
    {
     "ref": "src:islamhouse-qj-doc#q052",
     "excerpt_ar": "لأننا إنما قدمنا الأصل حيث لا مرجح سواه، فإذا وجد ما هو أقوى منه وجب تقديم الأرجح"
    }
   ],
   "reading_rules": [
    29
   ],
   "lean": [
    "Usul.Tanaqud.t8",
    "Usul.Tanaqud.t8_clash",
    "Usul.Tanaqud.t8_jam"
   ],
   "table": [
    {
     "case": [
      "wahm"
     ],
     "first": false,
     "second": true,
     "jam": true
    },
    {
     "case": [
      "shakk"
     ],
     "first": false,
     "second": true,
     "jam": true
    },
    {
     "case": [
      "zann"
     ],
     "first": false,
     "second": true,
     "jam": false
    },
    {
     "case": [
      "qat"
     ],
     "first": false,
     "second": true,
     "jam": false
    }
   ]
  },
  {
   "id": "T-09",
   "rules": [
    12,
    45
   ],
   "case_en": "Whose consent is needed: Q12 requires mutual consent in exchanges; Q45 needs neither the consent nor the knowledge of one whose consent is not required.",
   "resolution": "jam",